{
    "$schema": "https://raw.githubusercontent.com/JoranSlingerland/StockTracker/main/.data/input/input_schema.json",
    "transactions": [
        {
            "symbol": "AAPL",
            "transaction_date": "2019-01-21",
            "cost": 100.00,
            "quantity": 100,
            "transaction_type": "Buy",
            "transaction_cost": 0.50,
            "currency": "USD"
        },
        {
            "symbol": "AAPL",
            "transaction_date": "2020-01-21",
            "cost": 125.00,
            "quantity": 100,
            "transaction_type": "Buy",
            "transaction_cost": 0.50,
            "currency": "USD"
        },
        {
            "symbol": "MSFT",
            "transaction_date": "2021-10-24",
            "cost": 100.00,
            "quantity": 100,
            "transaction_type": "Buy",
            "transaction_cost": 0.50 ,
            "currency": "USD"
        }
    ],
    "cash": [
        {
            "transaction_date": "2019-01-21",
            "transaction_type": "Deposit",
            "amount": 125.00
        },
        {
            "transaction_date": "2020-01-21",
            "transaction_type": "Withdrawal",
            "amount": 100.00
        },
        {
            "transaction_date": "2021-10-24",
            "transaction_type": "Deposit",
            "amount": 100.00
        }
    ],
    "api_key": "ABCD1234EFGH5678",
    "sql_server": {
        "server": "localhost",
        "database": "StockTracker",
        "user": "sa",
        "password": "Password123",
        "tables": [
            {
                "table_name": "cash_held",
                "columns": {
                    "date": "DATE",
                    "amount": "MONEY"
                }
            },
            {
                "table_name": "stocks_held",
                "columns": {
                    "date": "DATE",
                    "symbol": "TEXT",
                    "average_cost": "MONEY",
                    "total_cost": "MONEY",
                    "quantity": "DECIMAL(38,2)",
                    "transaction_cost": "MONEY",
                    "currency": "TEXT",
                    "close_value": "MONEY",
                    "high_value": "MONEY",
                    "low_value": "MONEY",
                    "open_value": "MONEY",
                    "volume": "DECIMAL(38,2)",
                    "total_value": "MONEY"
                }
            },
            {
                "table_name": "totals",
                "columns": {
                    "date": "DATE",
                    "total_cost": "MONEY",
                    "total_value": "MONEY"
                }
            },
            {
                "table_name": "single_day",
                "columns": {
                    "symbol": "TEXT",
                    "average_cost": "MONEY",
                    "total_cost": "MONEY",
                    "quantity": "DECIMAL(38,2)",
                    "transaction_cost": "MONEY",
                    "currency": "TEXT",
                    "close_value": "MONEY",
                    "high_value": "MONEY",
                    "low_value": "MONEY",
                    "open_value": "MONEY",
                    "volume": "DECIMAL(38,2)",
                    "total_value": "MONEY"
                }
            }
        ]
    }
}